### ISSUE TITLE
Sensu not connecting to Redis Sentinel Cluster

### ISSUE THREAD

**Issue by RiRa12621** [sensu/sensu#1245]
Hey there,
we are using Sensu with a cluster of 3 Redis nodes per Datacenter where each node is working as Sentinel. 
The cluster itself is working as expected and also replication of Master <==> Slave is working flawless just as the failover is working fine.
But for a reason we don't know, Sensu cannot connect to the Redis Sentinels and thus is not connecting to the Redis master and thus not starting up.
Here is our config for /etc/sensu/conf.d/redis.json

`{
  "redis": {
    "sentinels": [
      {
        "host": "sensuredis38-1.sensitive.info",
        "port": 26379
      },
      {
        "host": "sensuredis38-2.sensitive.info",
        "port": 26379
      },
      {
        "host": "sensuredis38-3.sensitive.info",
        "port": 26379
      }
    ]
  }
}`

As I said Sentinels and Redis itself is working without problems but if you need config form there, let me know

Additional info:

We are on Sensu version 0.23.2-1
We are on Redis-server version 2.8.17-1~bpo70+2
Operating System is Debian 7.8 on the Redis machines and Ubuntu 14.04.2 on the Sensu-servers

**Comment by lgarciaaco** [comment]
I also have the same issue. The setup is prerry much the same, but I am using embedded ruby. Logfiles dont say much ...

**Comment by RiRa12621** [comment]
oh yeah here’s the last log entries form sensu-server and sensu-api log


`{"timestamp":"2016-04-27T13:20:15.396154+0200","level":"warn","message":"loading extension files from directory","directory":"/etc/sensu/extensions"}
{"timestamp":"2016-04-27T13:20:15.396274+0200","level":"warn","message":"loaded extension","type":"mutator","name":"ruby_hash","description":"returns ruby hash event data"}
{"timestamp":"2016-04-27T13:20:15.396345+0200","level":"warn","message":"loaded extension","type":"mutator","name":"json","description":"returns JSON formatted event data"}
{"timestamp":"2016-04-27T13:20:15.396413+0200","level":"warn","message":"loaded extension","type":"mutator","name":"only_check_output","description":"returns check output"}
{"timestamp":"2016-04-27T13:20:15.396506+0200","level":"warn","message":"loaded extension","type":"handler","name":"debug","description":"returns raw event data"}
{"timestamp":"2016-04-27T13:20:15.413891+0200","level":"debug","message":"connecting to redis","settings":{"sentinels":[{"host":"sensuredis38-1.sensitive.info","port":26379},{"host":"sensuredis38-2.sensitive.info","port":26379},{"host":"sensuredis38-3.sensitive.info","port":26379}]}}`


it is the same entry for both

**Comment by portertech** [comment]
@RiRa12621 do the Redis Sentinel logs show connections? Are the Sensu instances able to reach Sentinel? e.g. telnet sensuredis38-2.sensitive.info 26379

**Comment by RiRa12621** [comment]
telnet works for all the instances
the sentinel logs only show that it starts up and detects all slaves and master but nothing about sensu connecting

**Comment by portertech** [comment]
@RiRa12621 perhaps reduce the configured sentinels in Sensu to be a single node and use something like tcpdump to confirm an attempt is made?

**Comment by portertech** [comment]
@RiRa12621 any additional information that you can provide is much appreciated :+1:

**Comment by RiRa12621** [comment]
@portertech i did that for testing
so i shrinked the config to the following:

`{
  "redis": {
        "sentinels": [
        {
                "host": "sensuredis38-3.sensitive.info",
                "port": 26379
        }
        ]
  }
}
`

and did a tcpdump to confirm it’s attempting to connect

```
[root@sensu38-2:~]# tcpdump | grep 26379
tcpdump: verbose output suppressed, use -v or -vv for full protocol decode
listening on eth0, link-type EN10MB (Ethernet), capture size 65535 bytes
17:33:53.048541 IP sensu38-2.sensitive.info.52796 > sensuredis38-3.sensitive.info.26379: Flags [P.], seq 2675061267:2675061329, ack 2707129701, win 238, options [nop,nop,TS val 851339016 ecr 19275683], length 62
17:33:53.048857 IP sensuredis38-3.sensitive.info.26379 > sensu38-2.sensitive.info.52796: Flags [P.], seq 1:6, ack 62, win 227, options [nop,nop,TS val 19275933 ecr 851339016], length 5
17:33:53.048874 IP sensu38-2.sensitive.info.52796 > sensuredis38-3.sensitive.info.26379: Flags [.], ack 6, win 238, options [nop,nop,TS val 851339016 ecr 19275933], length 0
17:33:53.134514 IP sensu38-2.sensitive.info.52799 > sensuredis38-3.sensitive.info.26379: Flags [P.], seq 2262169287:2262169349, ack 4093838819, win 238, options [nop,nop,TS val 851339037 ecr 19275705], length 62
17:33:53.134881 IP sensuredis38-3.sensitive.info.26379 > sensu38-2.sensitive.info.52799: Flags [P.], seq 1:6, ack 62, win 227, options [nop,nop,TS val 19275955 ecr 851339037], length 5
17:33:53.134907 IP sensu38-2.sensitive.info.52799 > sensuredis38-3.sensitive.info.26379: Flags [.], ack 6, win 238, options [nop,nop,TS val 851339038 ecr 19275955], length 0
17:33:54.049187 IP sensu38-2.sensitive.info.52796 > sensuredis38-3.sensitive.info.26379: Flags [P.], seq 62:124, ack 6, win 238, options [nop,nop,TS val 851339266 ecr 19275933], length 62
17:33:54.049545 IP sensuredis38-3.sensitive.info.26379 > sensu38-2.sensitive.info.52796: Flags [P.], seq 6:11, ack 124, win 227, options [nop,nop,TS val 19276183 ecr 851339266], length 5
17:33:54.049562 IP sensu38-2.sensitive.info.52796 > sensuredis38-3.sensitive.info.26379: Flags [.], ack 11, win 238, options [nop,nop,TS val 851339266 ecr 19276183], length 0

```

Yeah I will try to provide us much as possible but it’s like we really don’t get to much out of the logs after all .

As I said: telnet connects

and if i connect sensu directly to redis with host and port and without sentinel, it also works flawlessly

**Comment by portertech** [comment]
@RiRa12621 did you use a different Redis master name? Default name is "master".

**Comment by portertech** [comment]
We definitely need to add more logging to the Redis client :+1:

**Comment by RiRa12621** [comment]
@portertech yes we did use a different master name “node01”

**Comment by portertech** [comment]
@RiRa12621 you need to add "master": "node01" to your Redis definition (top level).

**Comment by portertech** [comment]
@calebhailey this is missing from the Redis docs.

**Comment by calebhailey** [comment]
@portertech noted. I'll add that ASAP.

**Comment by portertech** [comment]
@calebhailey :boom:

**Comment by portertech** [comment]
@RiRa12621 you'll want to ensure that your master name remains consistent.

**Comment by RiRa12621** [comment]
```
{
  "redis": {
    “master”: “Name-of-master”,
    "password": "your_redis_password",
    "sentinels": [
      {
        "host": "10.0.1.23",
        "port": 26379
      },
      {
        "host": "10.0.1.24",
        "port": 26379
      },
      {
        "host": "10.0.1.25",
        "port": 26379
      }
    ]
  }
}
```

so it is supposed to be like this?
but then this is the opposite of the documentation where it says that sensu is self discovering the master via sentinels.

as of here”
```
to use the HA Redis configuration, they must be configured to query Redis Sentinel for the current Redis master connection information (host and port).
```

**Comment by portertech** [comment]
@RiRa12621 the Redis client queries Sentinel for a master from the master group, which actually defaults to "mymaster". The master key should probably be changed to master_group.

**Comment by RiRa12621** [comment]
ok, fine it’s just a matter of documentation then. 
it’s working if i change the config like this.

Thx a lot for the very quick help!

**Comment by lgarciaaco** [comment]
bravo!! but redis client output is still non existent ;)

thanks!

**Comment by portertech** [comment]
@RiRa12621 @lgarciaaco great! We'll be tracking Redis logging improvements @ https://github.com/sensu/sensu-redis/issues/1 and updating the Redis configuration documentation!

**Comment by calebhailey** [comment]
Tracking documentation changes here: https://github.com/sensu/sensu-docs/issues/380

**Comment by calebhailey** [comment]
This has been documented here: https://sensuapp.org/docs/latest/reference/redis.html#redis-attributes
